{
  "run_id": "m3",
  "request_id": "m3-guardrail-r2",
  "agent": "guardrail",
  "contract_version": "1.0",
  "mode": "workflow",
  "today": "2026-10-23",
  "question": "첫 카드 6개월 실적조건 해제 카드(가칭)를 재무와 준법 관점에서 점검해줘. 고칠 것과 법무에 확인받을 것을 나눠서.",
  "conversation": {
    "summary": "사용자 요청: GenZ 특화 신용카드 만들어줘. H1에서 범위 확인됨: GenZ(만 19~29세), 신용카드, 투자 연계 제외, 목표 채택 의향 0.38(가정치). H2에서 사람이 1순위 대신 3순위 셀(genz×simple)을 선택했다. H2에서 사람이 1순위 대신 3순위 셀(genz×simple)을 선택했다.",
    "segment": "GenZ(만 19~29세)",
    "card_type": "신용카드",
    "period": "최근 18개월(2025-04~2026-10)",
    "assumptions": [
      "GenZ를 기준일 2026-10-20 기준 1997~2007년생 중 신용카드 발급이 가능한 만 19~29세로 해석",
      "고객사 회원·결제 데이터 없이 공개 자료와 PM 가정치로 진행",
      "목표 채택 의향 0.38은 기존 리허설과 같은 PM 가정치"
    ],
    "own_cards": []
  },
  "output_mode": "json",
  "depth": "detail",
  "payload": {
    "card": {
      "working_title": "첫 카드 6개월 실적조건 해제 카드(가칭)",
      "lever": "target_subsegment",
      "variation": "타깃 세분 안으로, 신용카드 보유 이력이 없는 첫 카드 회원에게 편의점·대중교통·구독 3개 영역을 고정하고 6개월 뒤 전월실적 조건을 해제하는 짧은 해제형이며, 1안은 12개월·택2 영역의 일반 회원형, 3안은 해제 없이 월 단위로 미달분을 돌려주는 경험 설계다.",
      "one_liner": "신용카드 보유 이력이 없는 첫 카드 회원(만 19~29세)이 6개월 연체 0회이고 5개월 이상 월 1건 이상 이용하면 7개월 차부터 전월실적 조건이 해제되는 카드로, 졸업은 전월실적 조건 해제를 뜻하고 해제 후에도 영역별 월 한도 3천원은 그대로이며 연체 시 연습 구간으로 복귀한다. 연습 구간 혜택은 편의점, 대중교통, 구독 영역 한정, 전월 이용 40만원 이상인 달 한정, 영역별 월 한도 3천원, 미달 월은 기본 적립 0.5%, 연회비 1.5만원.",
      "segId": "genz",
      "need": "simple",
      "hook": "연체 없이 6개월 쓰고 월 1건 이상 이용하면 7개월 차부터 전월실적 조건이 해제되는 첫 카드(연체 시 복귀)",
      "special_point": {
        "hook": "신용카드 보유 이력이 없는 첫 카드 회원에게만 열어 두는 6개월 후 전월실적 조건 해제 구조(연체 0회, 5개월 이상 월 1건 이상 이용 충족 시, 연체 시 복귀)와 영역별 첫 이용 월 1회 한도 상향",
        "why_unusual": "경쟁 카드 130종 중 실적 졸업(perf_graduation)은 0종이고 첫 시도 보상(first_try_reward)도 경쟁 DB에서 0종이다(comp_empty, pick.unmet_gap). 카드의정석2 DAILY는 식비·장보기·교통·통신에 5%를 주지만 건당 최소 금액과 월 한도가 있고 가입 시기에 따른 조건 변화는 없다. 입력 근거에서 20대의 신용카드 보유는 1.3장으로 30~50대(2장 이상)보다 적다(ev:STF8).",
        "proof_mechanism": "발급 시 신용카드 보유 이력이 없는 회원만 가입 대상으로 하고, 발급 후 6개월 동안 전월 40만원 이상이면 편의점, 대중교통, 구독에서 2% 청구할인을 영역별 월 3천원 한도로 준다. 영역별 첫 이용 월에는 그 영역 한도를 5천원으로 영역별 1회만 올리며 반복되지 않는다. 6개월 연체 0회와 5개월 이상 월 1건 이상 이용이 충족되면 7개월 차부터 전월실적 조건을 해제하고, 해제 후에도 영역별 월 한도 3천원과 영역 고정은 유지되며 연체나 이용 중단이 이어지면 연습 구간으로 복귀한다.",
        "not_like": "흔한 방식은 신규 회원 첫 달이나 첫해 혜택을 키우는 가입 이벤트다. 이 안은 혜택 크기는 그대로 두고 전월실적 조건이 해제되는 시점을 발급 후 6개월로 정하며 대상을 첫 카드 회원으로 한정한다."
      },
      "cvp": {
        "target": "신용카드 보유 이력이 없는 첫 카드 회원인 만 19~29세로 카드 사용액이 크지 않은 고객",
        "need": "단순함: 처음 쓰는 카드의 실적 조건을 짧게 경험하고 해제되기를 원한다(need:simple)",
        "offer": "신용카드 보유 이력이 없는 첫 카드 회원 대상. 편의점, 대중교통, 구독 영역 한정, 전월 이용 40만원 이상인 달 한정 2% 청구할인(영역별 월 한도 3천원, 미달 월 기본 적립 0.5%, 연회비 1.5만원)과, 6개월 연체 0회 및 5개월 이상 월 1건 이상 이용 충족 시 7개월 차부터 전월실적 조건 해제(해제 후에도 영역별 월 한도 3천원 유지, 연체 시 복귀)",
        "key_benefit": "발급 후 6개월 뒤 전월실적 조건이 해제되는 구조이고(연체 0회, 5개월 이상 월 1건 이상 이용 충족 시, 연체 시 복귀, 영역별 월 한도 3천원 유지), 2% 청구할인은 편의점, 대중교통, 구독 영역 한정에 전월 이용 40만원 이상인 달 한정이며 미달 월은 기본 적립 0.5%이다(연회비 1.5만원). 영역별 첫 이용 월 한도 5천원은 영역별 1회만 적용된다.",
        "alternative": "경쟁 카드는 카드의정석2 DAILY(우리카드, 연회비 2.5만원). 자사 카드로는 지그재그 신한카드와 신한카드 Hi-Point Plan이 같은 영역에 있다.",
        "differentiator": "DAILY는 식비·장보기·교통·통신에 5%를 주되 월 한도와 건당 최소 금액이 붙고 정기결제 50%는 전월 50만원 이상이 필요한 반면, 이 안은 편의점, 대중교통, 구독 영역 한정 2%에 전월 40만원 조건을 발급 후 6개월 동안 두고 연체 0회 등 요건 충족 시 해제하며 연회비가 1만원 낮다. 자사 카드 중복 점검: 자사 신한카드 Hi-Point Plan은 전월 50만원 미만에도 기본 적립 0.5%를 주고(월 한도 통합 5만P), 자사 지그재그 신한카드는 전월실적 조건이 0원이다. 이 안은 신용카드 보유 이력이 없는 회원으로 대상을 좁히고 6개월 뒤 조건이 해제된다는 점이 다르며, 1안과는 대상과 기간으로 구분되어 둘을 함께 내면 서로 잠식할 수 있다.",
        "reason_to_believe": "ev:STF8, ev:STF48, ev:PFF20, ev:PFC6, tag:perf_graduation, tag:first_try_reward"
      },
      "tags": [
        "perf_graduation",
        "zero_floor",
        "first_try_reward"
      ],
      "rates": {
        "daily": 0.02,
        "trans": 0.02,
        "sub": 0.02
      },
      "capPerCat": 0.3,
      "fee": 1.5,
      "minPerf": 40,
      "cx": 0.4,
      "links": [],
      "mechanics": [
        "대상: 신용카드 보유 이력이 없는 첫 카드 회원인 만 19~29세 본인 회원만 대상이다. 보유 이력 확인에 쓰는 정보와 동의 범위는 사람 확인이 필요하다. 가입은 앱에서 하고 간편결제 등록을 기본 접점으로 둔다.",
        "연습 구간(발급 후 6개월): 편의점, 대중교통, 구독 영역에 한정해 전월 이용 40만원 이상인 달에 2% 청구할인을 영역별 월 3천원 한도로 받고, 미달 월에는 국내 가맹점 기본 적립 0.5%만 적용한다. 영역별 첫 이용 월에는 그 영역 한도를 5천원으로 영역별 1회만 올리며 반복 혜택이 아니다.",
        "졸업(전월실적 조건 해제): 6개월 동안 결제대금 연체 0회이고 5개월 이상 월 1건 이상 이용하면 7개월 차부터 전월실적 조건이 해제된다. 해제 후에도 영역별 월 한도 3천원과 영역 고정은 그대로이고, 연체가 발생하면 연습 구간으로 복귀한다. 2%, 기본 적립 0.5%, 첫 이용 한도 상향은 각각 별도 조건의 혜택이며 합산 비율로 안내하지 않는다.",
        "체리피킹 방어: 월 1건 이상 이용만으로는 소액 결제로 조건을 채울 수 있으므로 졸업 판정에 이용 금액 하한을 두는 안과, 해제 후 일정 기간 이용이 없으면 연습 구간으로 복귀시키는 안을 설계에 포함한다(금액과 기간은 시뮬레이션으로 정하며 이 입력에는 없다). 첫 이용 한도 상향은 영역별 1회로 제한하고, 해지 후 재발급으로 반복 수령하지 못하도록 보유 이력 확인이 작동해야 한다. 고지와 표기: 졸업 기준, 시점, 한도, 연습 구간 복귀 규칙을 상품설명서와 약관에 적고 졸업 1개월 전부터 앱에서 남은 조건을 알린다. 2%가 나오는 모든 지면에 영역 한정, 전월 40만원 이상인 달 한정, 영역별 월 한도 3천원, 미달 월 기본 적립 0.5%, 연회비 1.5만원을 같은 크기로 병기하고, 경쟁 비교에 '최초', '유일'을 쓰지 않는다. 마케팅 문구는 첫 카드 이용자의 일상 사용 중심으로 쓰고 혜택 비교 커뮤니티용 '조건 맞추면 이득' 식 메시지를 피한다. 집행 전 문구는 광고심의 검토를 거치며 혜택 변경은 사전 고지한다."
      ],
      "evidence_ids": [
        "ev:STF8",
        "ev:STF48",
        "ev:PFF20",
        "ev:PFC6"
      ],
      "assumptions": [
        "첫 신용카드 회원은 짧은 졸업 구조를 긴 연습 구간보다 선호한다(가정, 입력에 20대 선호 근거는 없다)",
        "편의점, 대중교통, 구독 3개 영역의 소액 소비가 전월 40만원 실적을 채우는 데 충분하다(가정, 청년 카드 사용액의 50.4%가 25만원 미만이라는 ev:STF48과 충돌할 수 있다)",
        "신용카드 보유 이력 확인과 대상 한정을 심사 단계에서 처리할 수 있다(내부 데이터 확인 필요)"
      ],
      "hypotheses": [
        "첫 카드에서 전월 40만원 조건이 6개월 동안 적용되는 것을 어떻게 느끼며 이용액이 이보다 적다면 이 카드를 발급하겠습니까?",
        "6개월 졸업과 12개월 졸업 중 어느 쪽이 더 믿을 만하며 졸업 후 영역 혜택 한도가 그대로여도 만족합니까?",
        "영역별 첫 이용 월에 한도가 올라가는 보상이 새 영역을 써 보는 행동을 늘립니까?",
        "졸업이 전월실적 조건 해제를 뜻한다는 설명이 이름과 한 줄에 함께 있을 때 해제 후에도 월 한도 3천원이 유지되고 연체 시 복귀한다는 조건을 이해합니까?"
      ],
      "risks": [
        "ev:STF48의 청년 카드 사용액 분포(25만원 미만 50.4%)에 비해 전월 40만원은 높아 목표 고객이 실적을 채우지 못할 수 있다",
        "첫 카드 한정은 신용카드 보유 이력 조회가 필요하고 개인정보 활용 범위는 사람 확인 필요이다",
        "20대 선호 근거가 없고 ev:PFF20은 20대 대상 추천 설명글 한 건이라 졸업 구조의 수요는 가상 고객 검증 전이다",
        "체크카드 중심 이용자에게는 월 1건 이용 조건과 연체 0회 조건이 처음 접하는 신용 관리 규칙이어서 안내가 부족하면 오해가 생길 수 있다(사람 확인 필요)",
        "자사 Hi-Point Plan의 기본 적립과 1안이 같은 첫 카드 고객을 두고 겹쳐 잠식할 수 있다(내부 데이터 확인 필요)",
        "체리피커 비중 0.43, 체리피커 손익 -0.62(재작업 입력의 시뮬레이션 지표)이며 현재 모형은 졸업 시점, 연체 복귀, 월 1건 이용 조건을 반영하지 못해 해제 후 이용 급감과 한도 도달 직후 이용 중단은 반영되지 않는다. 영역별 월 한도 3천원과 2% 비율 유지 여부는 재무와 상품이 정해야 하며 혜택 20% 축소 시 채택 의향 0.272와 비교해야 한다.",
        "출시 후 졸업 직후 이용 급감, 영역별 한도 도달 직후 이용 중단, 졸업률, 연습 구간 복귀율을 운영 지표로 점검해야 한다.",
        "광고 문구는 2%, 기본 적립 0.5%, 첫 이용 한도 상향이 합산된 것으로 오인될 수 있어 광고심의 검토가 필요하다(사람 확인 필요)."
      ],
      "rationale": "혜택 방식은 1안과 같은 실적 졸업을 쓰되 레버를 타깃 세분으로 옮겼다. 대상은 신용카드 보유 이력이 없는 회원, 영역은 소액 소비가 많은 편의점·대중교통·구독 3곳, 졸업은 6개월로 좁혔다. 실적 조건이 핵심이므로 minPerf는 첫 기간의 40만원으로 썼다. ev:STF8은 20대 범위이고 ev:PFF20은 20대 대상 설명글, ev:PFC6은 해외 카드의 첫해 한정 보상 사례다. 영역별 첫 이용 한도 상향은 first_try_reward에 대응한다. 재작업 반영: 사전 점검 지적에 따라 이름의 '졸업'을 '실적조건 해제'로 풀어 쓰고 hook과 one_liner에 졸업 요건, 해제 후 한도 유지, 연체 시 복귀를 함께 썼다. 2% 표기마다 영역, 전월 40만원 이상인 달, 월 한도, 미달 월 0.5%, 연회비를 병기하고 합산·'최초'·'유일' 표현을 막았으며, 체리피킹 방어(이용 금액 하한, 이용 중단 시 복귀, 1회 한도 상향 제한)를 mechanics와 risks에 추가했다. 혜택률, 한도, 조건 수치는 바꾸지 않았다."
    },
    "metrics": {
      "name": "첫 카드 6개월 실적조건 해제 카드(가칭)",
      "profit": 3.04,
      "novelty": 0.67,
      "sim": 0.11,
      "nearest": "지그재그 신한카드",
      "adopt": 0.392,
      "adopterProfit": 1.71,
      "cherry": 0.43,
      "appliedCx": 0.4,
      "topReject": "inertia"
    },
    "twin": {
      "target_adopt": 0.392,
      "by_type": {
        "일반형": {
          "share_of_adopters": 0.34,
          "profit": 3.11
        },
        "혜택 사냥꾼(체리피커)": {
          "share_of_adopters": 0.43,
          "profit": -0.62
        },
        "충성형": {
          "share_of_adopters": 0.05,
          "profit": 4.34
        },
        "휴면 위험형": {
          "share_of_adopters": 0.18,
          "profit": 3.89
        }
      },
      "adopter_profit": 1.71,
      "static_profit": 3.04,
      "scenarios": [
        {
          "name": "기본",
          "adopt": 0.392
        },
        {
          "name": "경쟁사 모방(새로움 50%↓)",
          "adopt": 0.328
        },
        {
          "name": "혜택 20% 축소",
          "adopt": 0.272
        },
        {
          "name": "시장 위축",
          "adopt": 0.267
        }
      ]
    },
    "check_items": [
      {
        "id": "G1",
        "item": "이름·한 줄 약속과 실제 작동 방식 일치(과장·불일치)"
      },
      {
        "id": "G2",
        "item": "광고 표현 위험(단정·과장·오인 소지, 합산 혜택 오인)"
      },
      {
        "id": "G3",
        "item": "부가서비스 변경 제한·혜택 지급 조건 고지"
      },
      {
        "id": "G4",
        "item": "그룹사(증권·보험·은행) 연계 시 개인정보 결합·제3자 제공 동의"
      },
      {
        "id": "G5",
        "item": "투자 연계 상품의 투자권유·원금 손실 오인"
      },
      {
        "id": "G6",
        "item": "체리피킹·역선택 대비(채택 고객 유형별 손익 참고)"
      }
    ],
    "precheck_flags": [
      {
        "check_id": "G6",
        "flag": "체리피커가 채택자의 0.43로 20% 이상이면서 손익 -0.62로 3 미만"
      }
    ],
    "review_level": "standard"
  }
}