{
  "run_id": "b2",
  "request_id": "b2-guardrail-r1",
  "agent": "guardrail",
  "contract_version": "1.0",
  "mode": "workflow",
  "today": "2026-10-23",
  "question": "첫 카드 실적 졸업 카드(가칭)를 재무와 준법 관점에서 점검해줘. 고칠 것과 법무에 확인받을 것을 나눠서.",
  "conversation": {
    "summary": "사용자 요청: GenZ 특화 신용카드 만들어줘. H1에서 범위 확인됨: GenZ(만 19~29세), 신용카드, 투자 연계 제외, 목표 채택 의향 0.38(가정치). H2에서 사람이 1순위 대신 2순위 셀(genz×saving)을 선택했다.",
    "segment": "GenZ(만 19~29세)",
    "card_type": "신용카드",
    "period": "최근 18개월(2025-04~2026-10)",
    "assumptions": [
      "GenZ를 기준일 2026-10-20 기준 1997~2007년생 중 신용카드 발급이 가능한 만 19~29세로 해석",
      "고객사 회원·결제 데이터 없이 공개 자료와 PM 가정치로 진행",
      "목표 채택 의향 0.38은 기존 리허설과 같은 PM 가정치"
    ],
    "own_cards": []
  },
  "output_mode": "json",
  "depth": "detail",
  "payload": {
    "card": {
      "working_title": "첫 카드 실적 졸업 카드(가칭)",
      "lever": "target_subsegment",
      "variation": "첫 신용카드를 만드는 만 19~24세를 따로 보고, 발급 후 실적 조건을 낮게 시작해 단계적으로 올리는 졸업 구조 안이며, 1·2안의 놓친 혜택 환급을 중심 장치로 쓰지 않고 같은 외식·배달 영역을 실적 부담 완화로 푼다.",
      "one_liner": "만 19~24세 첫 신용카드 고객에게 외식·배달 2% 캐시백(월 한도 5천원)을 전월 이용실적 10만원 이상으로 시작해 3개월마다 실적과 한도를 단계적으로 올리고, 미달 달에도 0.5%는 지급하는 카드",
      "segId": "genz",
      "need": "saving",
      "hook": "첫 신용카드의 실적 조건을 낮게 시작해 단계적으로 올리고 미달 달에도 기본 혜택을 남기는 구조",
      "special_point": {
        "hook": "첫 신용카드 고객의 외식·배달 실적 조건을 10만원에서 시작해 3개월마다 올리는 실적 졸업 구조",
        "why_unusual": "입력 DB 130종 중 perf_graduation, first_try_reward 태그는 0종이고 life_event는 2종뿐이다. competitor_refs의 LOCA LIKIT Eat는 전월 40만원, 쏘카카드는 전월 30만원 이상 조건이 처음부터 고정이고, 자사 처음(ANNIVERSE)도 전월 30만원이라 첫 카드 고객의 이용 단계에 맞춰 조건이 변하는 구조는 입력에 없다.",
        "proof_mechanism": "발급 후 1~3개월은 전월 이용실적 10만원, 4~6개월은 20만원, 7개월 이후는 30만원 단계로 올리고 외식·배달 월 한도도 5천원, 8천원, 1만원으로 같이 올린다. 단계 중 실적 미달 달에도 외식·배달 0.5%(월 한도 1천원)는 지급해 혜택이 0이 되지 않게 한다.",
        "not_like": "처음부터 높은 실적 구간을 두는 구간제나 신규 발급 한시 프로모션과 달리, 첫 카드 고객의 이용 단계에 맞춰 조건과 한도가 함께 올라가는 졸업 구조다."
      },
      "cvp": {
        "target": "첫 신용카드를 만드는 만 19~24세(청년 발급 문턱 완화 흐름 T1 기준)",
        "need": "절약(need:saving)과 단순함. 처음부터 높은 실적을 채워야 하는 부담이 크다",
        "offer": "실적 10만원에서 시작해 단계적으로 올리는 외식·배달 2% 캐시백과 미달 달 기본 0.5%",
        "key_benefit": "첫 3개월은 전월 이용실적 10만원으로 외식·배달 2%(월 한도 5천원)를 받고, 미달 달에도 0.5%(월 한도 1천원)는 받는다",
        "alternative": "LOCA LIKIT Eat(롯데카드, 경쟁 카드), 쏘카카드(현대카드, 경쟁 카드). 같은 영역의 자사 카드로 처음(ANNIVERSE)이 있다",
        "differentiator": "LOCA LIKIT Eat는 전월 40만원, 쏘카카드는 전월 30만원 이상 조건이 처음부터 적용된다. 이 안은 첫 3개월 10만원으로 시작해 올리므로 첫 카드 고객의 진입 부담이 다르다. 자사 처음(ANNIVERSE)은 2030세대를 겨냥하고 전월 30만원 조건에 연회비 15,000원이지만, 이 안은 만 19~24세 첫 카드 고객으로 대상을 좁히고 연회비 0원, 조건 단계 상승을 쓴다. 두 카드가 같은 연령대를 두고 겹치는 정도는 내부 데이터 확인 필요.",
        "reason_to_believe": "T1, ev:MHT1, ev:PFT5, need:saving"
      },
      "tags": [
        "perf_graduation",
        "first_try_reward",
        "zero_floor",
        "life_event",
        "dining_cafe"
      ],
      "rates": {
        "dining": 0.02,
        "online": 0.004
      },
      "capPerCat": 0.5,
      "fee": 0,
      "minPerf": 10,
      "cx": 0.45,
      "links": [],
      "mechanics": [
        "대상과 단계: 만 19~24세 개인 회원 중 신규 발급 시 보유 신용카드가 없는 고객이 앱에서 발급하며 연회비는 없다. 발급 후 1~3개월은 전월 이용실적 10만원, 4~6개월은 20만원, 7개월 이후는 30만원 조건으로 외식·배달 2%, 온라인쇼핑 0.4%를 다음 청구에 캐시백한다.",
        "한도와 기본 혜택: 외식·배달 월 한도는 단계별로 5천원, 8천원, 1만원으로 올라간다. 단계 조건에 미달한 달에도 외식·배달 0.5%(월 한도 1천원)는 지급한다.",
        "체리피킹 방어: 단계는 발급일 기준으로만 올라가며 한 번 올라간 단계는 내리지 않는다. 신규 발급 고객 판정은 발급 시점 1회이고, 할부·취소 건과 상품권·선불충전 결제는 실적과 산정액에서 제외한다.",
        "전환과 고지: 만 25세가 된 해의 다음 달부터 일반 이용 조건으로 전환하며, 단계 변경 시점과 전환 시점은 적용 1개월 전 앱과 문자로 사전 고지한다. 혜택 변경과 환급 조건은 사전 고지하고, 환급 산정 근거는 앱에서 매월 보여 준다."
      ],
      "evidence_ids": [
        "T1",
        "ev:MHT1",
        "ev:PFT5",
        "ev:MHT2",
        "need:saving"
      ],
      "assumptions": [
        "첫 신용카드 고객은 높은 전월 실적 조건에 부담을 느끼고, 낮게 시작해 올라가는 구조를 수용한다(가정)",
        "신규 발급 시 보유 신용카드 없음 판정을 심사 과정에서 확인할 수 있다(사람 확인 필요)",
        "ev:MHT1, ev:MHT2는 Z세대 범위 자료이고 ev:PFT5는 20대 대상 추천글이며 홍보성 글 기준이라 근거가 약하다(가정으로 보완)"
      ],
      "hypotheses": [
        "첫 신용카드라면 전월 이용실적 10만원으로 시작해 3개월마다 올라가는 조건을 기존 고정 30만원 조건보다 선호하십니까?",
        "단계가 올라갈 때 외식·배달 월 한도도 함께 올라가는 방식이 이해하기 쉽다고 느끼십니까?",
        "미달 달에도 기본 0.5%가 남는 구조가 실적 부담을 얼마나 줄여 줍니까?"
      ],
      "risks": [
        "첫 카드 대상 한정은 발급 심사 기준과 청년 발급 문턱 완화 세부 기준(T1)에 따라 달라질 수 있어 사람 확인 필요",
        "단계가 올라간 뒤 휴면하는 고객이 늘 수 있어 시장성 검증에서 확인한다",
        "만 25세 전환 시점 고지와 약관 반영은 사람 확인 필요",
        "자사 처음(ANNIVERSE)과 대상 연령이 겹쳐 잠식이 생길 수 있다(내부 데이터 확인 필요)"
      ],
      "rationale": "3안 중 1·2안이 miss_refund를 중심 장치로 쓰고, 이 안은 같은 외식·배달 영역을 타깃 세분 레버로 푼다. 조건이 단계적으로 올라가므로 체리피킹 방어는 단계 불가역과 신규 판정 1회로 둔다. 혜택률과 한도는 원가 검증 전 설계값이다."
    },
    "metrics": {
      "name": "첫 카드 실적 졸업 카드(가칭)",
      "profit": 1.1,
      "novelty": 0.4,
      "sim": 0.2,
      "nearest": "지그재그 신한카드",
      "adopt": 0.68,
      "adopterProfit": 0.46,
      "cherry": 0.25,
      "appliedCx": 0.45,
      "topReject": "inertia"
    },
    "twin": {
      "target_adopt": 0.68,
      "by_type": {
        "일반형": {
          "share_of_adopters": 0.49,
          "profit": 1.07
        },
        "혜택 사냥꾼(체리피커)": {
          "share_of_adopters": 0.25,
          "profit": -1.25
        },
        "충성형": {
          "share_of_adopters": 0.1,
          "profit": 2.62
        },
        "휴면 위험형": {
          "share_of_adopters": 0.17,
          "profit": -0.03
        }
      },
      "adopter_profit": 0.46,
      "static_profit": 1.1,
      "scenarios": [
        {
          "name": "기본",
          "adopt": 0.68
        },
        {
          "name": "경쟁사 모방(새로움 50%↓)",
          "adopt": 0.645
        },
        {
          "name": "혜택 20% 축소",
          "adopt": 0.523
        },
        {
          "name": "시장 위축",
          "adopt": 0.56
        }
      ]
    },
    "check_items": [
      {
        "id": "G1",
        "item": "이름·한 줄 약속과 실제 작동 방식 일치(과장·불일치)"
      },
      {
        "id": "G2",
        "item": "광고 표현 위험(단정·과장·오인 소지, 합산 혜택 오인)"
      },
      {
        "id": "G3",
        "item": "부가서비스 변경 제한·혜택 지급 조건 고지"
      },
      {
        "id": "G4",
        "item": "그룹사(증권·보험·은행) 연계 시 개인정보 결합·제3자 제공 동의"
      },
      {
        "id": "G5",
        "item": "투자 연계 상품의 투자권유·원금 손실 오인"
      },
      {
        "id": "G6",
        "item": "체리피킹·역선택 대비(채택 고객 유형별 손익 참고)"
      }
    ],
    "precheck_flags": [
      {
        "check_id": "G6",
        "flag": "체리피커가 채택자의 0.25로 20% 이상이면서 손익 -1.25로 3 미만"
      }
    ],
    "review_level": "standard"
  }
}