{
  "run_id": "sample-validation-001",
  "request_id": "sample-validation-001-r1",
  "agent": "validation",
  "contract_version": "1.0",
  "mode": "standalone",
  "today": "2026-10-17",
  "question": "함께쌓기 카드가 2030 투자입문자한테 먹힐지 가상 고객으로 돌려보고, 유형별로 어떻게 반응할지 알려줘.",
  "conversation": {
    "summary": "",
    "segment": "2030 투자입문자",
    "card_type": "신용카드",
    "period": "해당 없음",
    "assumptions": [
      "연회비가 있는 카드이므로 신용카드로 가정"
    ],
    "own_cards": []
  },
  "output_mode": "report",
  "depth": "detail",
  "payload": {
    "card": {
      "segId": "investor",
      "need": "social",
      "hook": "모임 챌린지를 채우면 내 적립 포인트 일부와 한도 내 보너스가 각자 몫으로 ETF 소수점 매수에 쓰이는 카드 (투자 수익을 약속하지 않음)",
      "tags": [
        "social",
        "group_pooling",
        "challenge",
        "invest_reward",
        "point_to_stock",
        "target_special"
      ],
      "rates": {
        "dining": 0.012,
        "online": 0.008
      },
      "capPerCat": 3,
      "fee": 1.5,
      "minPerf": 30,
      "cx": 0.45,
      "links": [
        "sec"
      ],
      "mechanics": [
        "모임 구성: 본인 인증을 마친 발급 회원 2~5명, 1인 1모임, 가입 후 첫 챌린지는 다음 달부터 적용하며 모임 변경은 분기 1회로 제한",
        "적립과 풀의 관계: 외식·온라인 적립은 전액 개인 적립이며, 회원이 정한 일부(절반 이내)만 모임 풀로 옮겨 각자 지분으로 기록된다. 옮긴 만큼 개인 적립에서 차감되어 풀 합산 자체는 추가 혜택이 아니다",
        "챌린지·보너스: 구성원 모두 전월 실적 30만원 이상이고 투자 계좌 자동이체를 유지하면 달성, 달성 시에만 월 보너스 한도 안에서 보너스 포인트가 지급되어 풀에 더해지며 실적 미달 회원은 보너스 지분에서 제외",
        "사용처와 고지: 풀(옮긴 포인트+보너스)은 모임이 고른 ETF 소수점 매수에만 쓰이고 지분은 앱에서 각자 확인. 투자 상품은 원금 손실이 발생할 수 있으며 카드 혜택은 투자 수익을 보장하지 않습니다"
      ],
      "evidence_ids": [
        "T3",
        "T2"
      ],
      "rationale": "기존 이름 '같이굴려요'와 약속이 투자 수익을 연상시켜, 실제 구조(적립 포인트 일부와 한도 내 보너스를 각자 지분으로 ETF 소수점 매수)에 맞게 '함께쌓기 카드'와 포인트 이동 중심 문구로 바꾸고, 개인 적립에서 풀로 옮기는 관계를 명시했으며, 체리피킹·휴면·모임 파밍 방어로 전월실적 30만원 조건과 가입 요건·보너스 지급 조건을 넣고 규칙은 4개로 합쳤다. social·group_pooling·challenge 태그는 경쟁 카드에서 0~1종으로 비어 있고 2030 플랫폼 특화 제휴 흐름(T3)과 소수점 투자(T2)가 근거다. social 니즈는 5순위라 투자 연계로 핵심 동기를 유지했다.",
      "working_title": "함께쌓기 카드"
    },
    "metrics": {
      "i": 0,
      "name": "함께쌓기 카드",
      "profit": 7.95,
      "novelty": 0.82,
      "sim": 0.17,
      "nearest": "처음(ANNIVERSE)",
      "adopt": 0.396,
      "adopterProfit": 5.55,
      "cherry": 0.21,
      "cx": 0.45,
      "indepCx": 0.45,
      "appliedCx": 0.45,
      "topReject": "inertia",
      "errs": [],
      "pass": true
    },
    "persona_types": [
      {
        "type": "일반형",
        "traits": "카테고리별 평균 소비 패턴, 평균 3년 유지"
      },
      {
        "type": "체리피커",
        "traits": "혜택 민감도 높고 전환 장벽 낮음, 혜택 카테고리에 소비를 몰고 나머지는 다른 카드, 1년 내 해지"
      },
      {
        "type": "충성형",
        "traits": "기존 카드 관성 큼, 전환하면 소비를 몰아 줌"
      },
      {
        "type": "휴면 위험형",
        "traits": "발급은 하지만 소비의 30%만 사용"
      }
    ],
    "twin": {
      "n_personas": 1760,
      "seed": 7,
      "target_adopt": 0.396,
      "all_segments_adopt": {
        "사회초년생(25-29)": 0.311,
        "1인가구 직장인(30-39)": 0.341,
        "맞벌이·육아 가구(35-49)": 0.355,
        "2030 투자입문자": 0.396,
        "액티브 시니어(55+)": 0.168,
        "프리랜서·N잡러": 0.363
      },
      "by_type": {
        "휴면 위험형": {
          "share_of_adopters": 0.15,
          "profit": 1.48
        },
        "일반형": {
          "share_of_adopters": 0.58,
          "profit": 7.41
        },
        "혜택 사냥꾼(체리피커)": {
          "share_of_adopters": 0.21,
          "profit": 2.47
        },
        "충성형": {
          "share_of_adopters": 0.06,
          "profit": 8.33
        }
      },
      "adopter_profit": 5.55,
      "static_profit": 7.95,
      "behav_floor": 1.5,
      "scenarios": [
        {
          "name": "기본",
          "adopt": 0.396
        },
        {
          "name": "경쟁사 모방(새로움 50%↓)",
          "adopt": 0.281
        },
        {
          "name": "혜택 20% 축소",
          "adopt": 0.376
        },
        {
          "name": "시장 위축",
          "adopt": 0.333
        }
      ],
      "top_reject": "inertia"
    },
    "target_adopt": 0.38
  }
}
