{
  "run_id": "genz-credit-alt-001",
  "request_id": "genz-credit-alt-001-concept-r1",
  "agent": "concept",
  "contract_version": "1.0",
  "mode": "workflow",
  "today": "2026-10-20",
  "question": "선택된 기회(GenZ 만 19~29세 × 단순함)로 서로 다른 신용카드 컨셉 3안을 만들어줘. 투자 연계는 범위 밖이다.",
  "conversation": {
    "summary": "사용자 요청: GenZ 특화 신용카드 만들어줘. H1에서 범위 확인됨: GenZ(만 19~29세), 신용카드, 투자 연계 제외, 목표 채택 의향 0.38(가정치). H2에서 사람이 1순위(구독·디지털) 대신 2순위 셀(GenZ × 단순함)을 선택했다.",
    "segment": "GenZ(만 19~29세)",
    "card_type": "신용카드",
    "period": "최근 18개월(2025-04~2026-10)",
    "assumptions": [
      "GenZ를 기준일 2026-10-20 기준 1997~2007년생 중 신용카드 발급이 가능한 만 19~29세로 해석",
      "고객사 회원·결제 데이터 없이 공개 자료와 PM 가정치로 진행",
      "목표 채택 의향 0.38은 기존 리허설과 같은 PM 가정치"
    ],
    "own_cards": []
  },
  "output_mode": "json",
  "depth": "detail",
  "payload": {
    "pick": {
      "rank": 2,
      "seg": "genz",
      "need": "simple",
      "rationale": "엔진 5위(0.338)로 4위 genz×social과 점수가 같다. 단순함은 GenZ 니즈 3순위(가중치 0.7, 복잡도 허용도 0.5)이고 첫 카드 안내 글들이 전월실적 조건과 한도 확인을 반복해 강조한다. 경쟁 DB에서 실적 구간제(tiered_perf)는 10종인데 실적조건 완화(anti_cap)는 0종이라 조건 구조의 공백이 뚜렷하다. 부가서비스 일방 변경 조항에 대한 시정 요구(T5)는 처음부터 지속 가능한 단순 혜택을 설계할 근거가 되고, 청년 금융이력부족자 발급 문턱 완화(T4)로 늘 수 있는 첫 신용카드 수요와도 맞는다. GenZ 셀 가운데 천장이 0.68로 가장 높다.",
      "evidence_ids": [
        "T5",
        "T4",
        "need:simple",
        "tag:anti_cap"
      ],
      "risk": "실적조건을 풀면 혜택 원가를 통제하기 어려워 혜택 수준이 낮아질 수 있고, 단순함만으로는 발급 동기가 약할 수 있다. T5는 2023년 출처가 포함된 오래된 근거이고 T4의 세부 발급 기준은 사람 확인 필요다."
    },
    "segment_pack": {
      "allowed_tags": {
        "plcc_brand": "브랜드 제휴(PLCC)",
        "delivery": "배달",
        "subscription_ott": "구독/OTT",
        "travel_fx": "해외결제·환전",
        "lounge": "공항라운지",
        "premium_voucher": "프리미엄 바우처",
        "bank_bundle": "은행 결합",
        "simple_flat": "단순 정률",
        "miss_refund": "놓친혜택 환급",
        "anti_cap": "실적조건 완화",
        "life_event": "라이프이벤트 전환",
        "ai_personalize": "AI 개인화",
        "group_pooling": "혜택 풀 공유",
        "social": "소셜",
        "invest_reward": "투자 리워드",
        "point_to_stock": "포인트→주식",
        "insurance_link": "보험 연계",
        "challenge": "챌린지",
        "time_slot": "시간대 선택",
        "esg_green": "친환경",
        "benefit_rental": "혜택 교체 구독",
        "dining_cafe": "외식·카페",
        "fuel": "주유",
        "transit": "대중교통·모빌리티",
        "fixed_bills": "공과금·통신·관리비",
        "mart_daily": "편의점·마트",
        "check_card": "체크카드",
        "govt_link": "정부 환급 연계(K-패스 등)",
        "online_shop": "온라인쇼핑",
        "reward_cashback": "환급(캐시백)형",
        "reward_discount": "청구할인형",
        "reward_point": "포인트 적립형",
        "reward_mileage": "마일리지형",
        "reward_flat_refund": "건당 정액 환급형",
        "tiered_perf": "실적 구간제",
        "spend_free": "무실적",
        "no_cap": "한도 없음",
        "discount_counts": "할인액 실적 인정",
        "perf_recharge": "실적 부족분 보전",
        "txn_threshold": "결제 건당 최소금액",
        "select_item": "항목 택1",
        "select_pack": "팩 택1",
        "common_plus_select": "공통+선택",
        "paymethod_bonus": "결제수단 가산",
        "period_bonus": "기간 보너스",
        "target_special": "대상 한정",
        "monthly_switch": "월 변경형",
        "count_based": "횟수 기준 혜택",
        "auto_best": "자동 최적 혜택"
      },
      "categories": {
        "dining": "외식·배달",
        "online": "온라인쇼핑",
        "sub": "구독·디지털",
        "trans": "교통·모빌리티",
        "travel": "여행·해외",
        "daily": "편의점·마트",
        "fixed": "통신·관리비"
      },
      "constraints": {
        "max_rate": 0.03,
        "max_cx": 0.5,
        "fee_range": [
          0,
          2
        ],
        "links_allowed": [
          "bank",
          "ins"
        ]
      },
      "segment": {
        "id": "genz",
        "name": "GenZ(만 19~29세)",
        "complexity_tolerance": 0.5,
        "need_weights": {
          "saving": 0.75,
          "invest": 0.3,
          "travel": 0.55,
          "digital": 0.85,
          "fixed_cost": 0.4,
          "safety": 0.25,
          "social": 0.7,
          "simple": 0.7
        }
      }
    },
    "comp_empty": [
      {
        "tag": "social",
        "reason": "34종 중 0종. 친구·지인과 혜택을 주고받는 소셜형 구조를 가진 카드가 없음"
      },
      {
        "tag": "group_pooling",
        "reason": "34종 중 0종. 여러 사람이 혜택 한도를 나눠 쓰는 구조가 없음"
      },
      {
        "tag": "challenge",
        "reason": "34종 중 1종(처음(ANNIVERSE))뿐이고 young 타깃 카드에는 없음"
      },
      {
        "tag": "ai_personalize",
        "reason": "34종 중 0종. 비슷한 auto_best(자동 최적 혜택)도 체크카드 1종(카카오뱅크 K-패스 프렌즈 체크)뿐"
      },
      {
        "tag": "anti_cap",
        "reason": "34종 중 0종. tiered_perf가 10종인 데 비해 실적조건 완화 태그는 없고, perf_recharge(실적 부족분 보전)도 2종뿐"
      },
      {
        "tag": "miss_refund",
        "reason": "34종 중 0종. 놓친 혜택을 돌려주는 환급형 카드가 없음"
      },
      {
        "tag": "benefit_rental",
        "reason": "34종 중 0종. 비슷한 monthly_switch(월 변경형)는 체크카드 2종뿐이고 신용카드에는 없음"
      },
      {
        "tag": "life_event",
        "reason": "34종 중 0종. 취업, 독립 같은 생애 전환 시점에 혜택이 바뀌는 카드가 없음"
      },
      {
        "tag": "esg_green",
        "reason": "34종 중 0종. 친환경 소비 혜택 태그를 가진 카드가 없음"
      }
    ],
    "comp_crowded": [
      {
        "tag": "reward_discount",
        "reason": "34종 중 15종으로 태그 집계 1위. 청구할인형 보상은 신한, 삼성, KB국민, 롯데, NH농협 등 대부분 발급사가 이미 채택"
      },
      {
        "tag": "travel_fx",
        "reason": "34종 중 14종으로 집계 2위. 해외결제·환전 혜택은 신용카드와 체크카드 양쪽에 넓게 퍼져 있음"
      },
      {
        "tag": "dining_cafe",
        "reason": "34종 중 12종. GenZ 생활 소비 영역 가운데 가장 붐비는 가맹점 태그"
      },
      {
        "tag": "mart_daily",
        "reason": "34종 중 11종. 편의점·마트 혜택은 생활형 카드의 기본 구성으로 굳어짐"
      },
      {
        "tag": "online_shop",
        "reason": "34종 중 10종. 온라인쇼핑 할인·적립은 young을 타깃에 넣은 신용카드 대부분이 보유"
      },
      {
        "tag": "tiered_perf",
        "reason": "34종 중 10종이 실적 구간제를 채택해 조건 구조가 서로 비슷함"
      },
      {
        "tag": "transit",
        "reason": "34종 중 9종으로 상위 8위권 동률. 대중교통·모빌리티 혜택은 young 전용 체크카드에 특히 몰려 있음"
      },
      {
        "tag": "subscription_ott",
        "reason": "34종 중 8종으로 상위 8개 태그 밖(동률 9종 태그들 다음 순위)이지만, GenZ 대상 신용카드 후보(Discount Plan+, LOCA 365, 올바른 FLEX 등)가 공통으로 넣고 있어 GenZ 기획 관점에서는 붐비는 영역으로 봄"
      }
    ],
    "consumer": {
      "top_needs": [
        {
          "need": "digital",
          "priority": 1,
          "evidence": "니즈 가중치 0.85(PM 가정치)로 가장 높고 디지털 수준 0.95다. 간편결제 일상화(T2)로 페이 등록과 앱 내 발급이 첫 접점이 된다. 공개 웹에서도 간편결제가 주 결제수단으로 언급된다(U-s7, U-s8).",
          "signal_ids": [
            "T2"
          ]
        },
        {
          "need": "saving",
          "priority": 2,
          "evidence": "니즈 가중치 0.75(PM 가정치). 월 소비 가정치는 외식 24, 온라인 20, 생활 12 순이라 이 영역 적립이 체감 혜택의 중심이다. 혜택 시점을 골라 쓰는 소비(T1)와 맞물린다.",
          "signal_ids": [
            "T1"
          ]
        },
        {
          "need": "simple",
          "priority": 3,
          "evidence": "니즈 가중치 0.7, 복잡도 허용도 0.5(PM 가정치). 첫 카드 안내 글들은 전월실적 조건과 한도 확인을 반복해 강조한다(U-s2, U-s4). 혜택 변경 우려(T5)도 단순하고 지속 가능한 구조를 요구한다.",
          "signal_ids": [
            "T5"
          ]
        },
        {
          "need": "social",
          "priority": 4,
          "evidence": "니즈 가중치 0.7(PM 가정치). 페이 플랫폼 중심의 결제 생활(T2)에서 자주 쓰는 플랫폼과의 연결이 소속감 요소가 될 수 있다. 공개 웹 근거는 확인하지 못해 추정이다.",
          "signal_ids": [
            "T2"
          ]
        },
        {
          "need": "travel",
          "priority": 5,
          "evidence": "니즈 가중치 0.55, 여행 월 소비 가정치 6. 해외결제 증가와 트래블카드 수수료 면제 경쟁(T3)이 있으나 체크카드 중심 시장이라 보조 혜택으로 두는 편이 맞다.",
          "signal_ids": [
            "T3"
          ]
        },
        {
          "need": "fixed_cost",
          "priority": 6,
          "evidence": "니즈 가중치 0.4, 고정비 월 소비 가정치 5로 낮다. 다만 20대 인기 카드 순위 상위에 공과금·통신 할인 카드가 언급되어(U-s1, U-s2) 보조 혜택 후보로 남긴다.",
          "signal_ids": []
        },
        {
          "need": "invest",
          "priority": 7,
          "evidence": "니즈 가중치 0.3(PM 가정치)으로 낮고, 이번 기획 범위(H1)에서 투자 연계를 제외했으므로 최하위로 둔다. 관련 시그널도 입력에 없다.",
          "signal_ids": []
        }
      ],
      "must_have": [
        "간편결제(네이버페이·카카오페이·토스페이) 등록과 앱 내 발급·관리(T2, 구독·디지털 0.85)",
        "외식·온라인·생활 등 주 소비 영역에서 체감되는 적립·할인(절약·캐시백 0.75)",
        "전월실적 조건과 할인 한도가 한눈에 보이는 단순한 혜택 구조(단순함 0.7, 복잡도 허용도 0.5)",
        "연회비 부담이 낮은 수준(첫 카드 선택 기준으로 언급, U-s1)",
        "출시 후 혜택 변경 가능성을 줄인 지속 가능한 혜택 설계와 변경 시 사전 고지(T5)"
      ],
      "can_give_up": [
        "보장·안전 부가서비스(니즈 점수 0.25)",
        "투자·자산형성 연계(니즈 점수 0.3, 범위 밖)",
        "고정비 절감 중심 혜택(니즈 점수 0.4, 보조 혜택으로만 검토)",
        "공항 라운지 등 프리미엄 여행 서비스(여행·해외 니즈 점수 0.55, 해외 수수료 면제 정도로 충분하다는 추정)"
      ]
    },
    "trend_refs": [
      {
        "id": "T1",
        "title": "혜택이 큰 시점을 골라 쓰는 가격 최적화 소비 확산(신한카드 2026 키워드 '프라이스 옵티마이징')",
        "impl": "확인한 것: 신한카드는 2026 키워드로 프라이스 옵티마이징과 타임 마케팅 인기를 제시했다(S1). 해석: GenZ 카드도 상시 할인보다 시간대·기간 한정 프로모션을 앱 알림과 묶는 설계를 검토할 만하다."
      },
      {
        "id": "T2",
        "title": "간편결제 일상화와 페이 플랫폼 경쟁 심화(한국은행 통계, 오픈서베이 2026 조사)",
        "impl": "확인한 것: 2025년 상반기 간편결제 일평균 이용금액이 1조464억원으로 처음 1조원을 넘었다(S2). 해석: GenZ 신용카드는 실물보다 네이버페이·카카오페이·토스페이 등록과 앱 내 발급 경험을 먼저 설계해야 하며, 20대 연령별 수치는 확인하지 못했다."
      },
      {
        "id": "T3",
        "title": "해외결제 증가와 트래블카드 수수료 면제 혜택 경쟁(하나카드·신한카드 주도)",
        "impl": "확인한 것: 2025년 상반기 개인 해외 카드 이용액은 10조6932억원으로 9.0% 늘었고, 해외 체크카드 결제 비중은 하나카드 41.9%, 신한카드 30%였다(S5, S6). 해석: 체크카드 중심 시장이라 신용카드는 해외 수수료 면제와 구독·앱 결제 혜택을 함께 묶어야 차별점이 생긴다."
      },
      {
        "id": "T4",
        "title": "금융이력 부족 청년의 신용카드 발급 문턱 완화 추진(금융위원회 2026 하반기 업무보고)",
        "impl": "확인한 것: 금융당국은 12월부터 대안신용평가 활용과 보증금 담보 신용카드 도입으로 청년 등 금융이력부족자 발급을 쉽게 하겠다고 했다(S8, S9). 해석: 첫 신용카드 수요가 커질 수 있어 낮은 한도로 시작해 이용 실적에 따라 올리는 구조를 검토할 만하며, 세부 기준은 사람 확인 필요다."
      },
      {
        "id": "T5",
        "title": "카드 부가서비스 일방 변경 조항에 대한 약관 시정 요구",
        "impl": "확인한 것: 공정위는 사전 고지 없이 부가서비스를 변경·중단할 수 있게 한 카드 약관 조항을 문제 삼아 금융위에 시정을 요청했다(S10, S11). 해석: 혜택 축소 가능성을 출시 후에 줄이기 어려우므로 지속 가능한 혜택 수준으로 처음부터 설계해야 한다(오래된 근거)"
      }
    ],
    "n_options": 3,
    "feedback": null
  }
}