{
  "run_id": "a0",
  "request_id": "a0-validation-r1",
  "agent": "validation",
  "contract_version": "1.0",
  "mode": "workflow",
  "today": "2026-10-23",
  "question": "이용액 1위 영역 자동 배정·구독 장부 카드(가칭)가 타깃에게 먹힐지 가상 고객으로 보고, 유형별 반응을 알려줘.",
  "conversation": {
    "summary": "사용자 요청: GenZ 특화 신용카드 만들어줘. H1에서 범위 확인됨: GenZ(만 19~29세), 신용카드, 투자 연계 제외, 목표 채택 의향 0.38(가정치).",
    "segment": "GenZ(만 19~29세)",
    "card_type": "신용카드",
    "period": "최근 18개월(2025-04~2026-10)",
    "assumptions": [
      "GenZ를 기준일 2026-10-20 기준 1997~2007년생 중 신용카드 발급이 가능한 만 19~29세로 해석",
      "고객사 회원·결제 데이터 없이 공개 자료와 PM 가정치로 진행",
      "목표 채택 의향 0.38은 기존 리허설과 같은 PM 가정치"
    ],
    "own_cards": []
  },
  "output_mode": "json",
  "depth": "detail",
  "payload": {
    "card": {
      "working_title": "이용액 1위 영역 자동 배정·구독 장부 카드(가칭)",
      "lever": "benefit_structure",
      "variation": "1안은 직전 3개월 이용액 합계 순위로 혜택 영역을 자동 배정하고 구독 결제 장부를 붙인 혜택 구조 안이고, 2안은 같은 자동 배정에 고객이 정한 월 예산 지킴 가산을 얹은 경험 안이며, 3안은 타깃을 만 19~24세 첫 신용카드 진입층으로 좁힌 안이다.",
      "one_liner": "외식·배달, 온라인쇼핑, 구독·디지털 중 직전 3개월 이용액이 가장 큰 영역에 1.1%, 나머지 두 영역에 0.3%를 다음 달 청구 시 캐시백하고 구독 결제 일정을 앱에 모아 주는 카드(전월 이용실적 10만원 이상인 달 한정, 영역별 월 한도 5천원)",
      "segId": "genz",
      "need": "digital",
      "hook": "혜택 영역을 고르지 않아도 직전 3개월 이용액 순위로 정해지고, 흩어진 구독 결제는 앱 장부로 모인다",
      "special_point": {
        "hook": "직전 3개월 영역별 이용액 순위로 혜택 영역을 자동 배정하고, 같은 앱 화면에 구독 결제 장부와 결제 예정 알림을 두는 구조",
        "why_unusual": "경쟁 카드 삼성 iD ON은 커피전문점·배달앱·델리 중 월 이용 1개 영역에 30%(월 한도 1만원, 전월 30만원, 연회비 2만원)를 자동 맞춤으로 주지만 고르는 영역이 외식 계열 3곳에 한정되고 구독 관리 기능은 입력에 없다. 입력 DB 50종 중 구독 장부 태그(subscription_ledger)는 0종이고, 구독의 단점 1위가 관리 부족 낭비 77.4%(ev:WTT6)인데도 이를 카드 설계에 넣은 경쟁 카드는 입력에 없다. 자사 Deep Dream 체크는 체크카드이고 월 최다 이용 영역 자동 선정이 있어 일부 겹치므로, 이 안은 신용카드이며 영역을 외식·온라인·구독 세 축으로 두고 구독 장부를 더한 점이 다르다.",
        "proof_mechanism": "매월 말일 세 영역의 직전 3개월 이용액 합계 순위를 계산해 1위 영역을 다음 달 1.1% 영역으로 배정하고(나머지 두 영역 0.3%, 영역별 월 한도 5천원), 반복 결제되는 구독을 앱 장부로 모아 월 합계와 다음 결제 예정일을 결제 3일 전에 알린다. 앱 첫 화면에는 현재 1위 영역을 월말 판정 전 중간 집계라는 표시와 함께 보여 준다.",
        "not_like": "흔한 방식은 고객이 혜택 팩을 미리 고르거나 한 업종 묶음에 높은 할인율을 주는 것이고, 이 안은 결제 내역의 순위 규칙으로 영역을 정하며 혜택과 구독 관리를 한 화면에 둔다."
      },
      "cvp": {
        "target": "간편결제를 주 결제수단으로 쓰고 구독 서비스가 여러 개인 만 19~29세",
        "need": "구독·디지털(need:digital)과 소비 관리, 혜택 선택의 번거로움 줄이기",
        "offer": "직전 3개월 이용액 1위 영역 자동 배정 캐시백과 구독 결제 장부·예정 알림",
        "key_benefit": "혜택 영역을 직접 고르지 않아도 1위 영역에 1.1%가 적용되고(나머지 두 영역 0.3%, 영역별 월 한도 5천원, 전월 이용실적 10만원 이상인 달 한정) 구독 결제 일정을 한곳에서 본다",
        "alternative": "삼성 iD ON(경쟁 카드, 월 1개 영역 자동 맞춤)과 영역을 직접 고르는 선택형 카드. 자사 Deep Dream 체크는 같은 영역의 자사 체크카드다.",
        "differentiator": "삼성 iD ON은 연회비 2만원, 전월 30만원, 외식 계열 3곳 중 1개 영역 30%(월 한도 1만원)이고, 이 안은 연회비 0.5만원, 전월 10만원, 세 영역 순위 배정에 낮은 비율과 구독 장부를 묶었다. 자사 Deep Dream 체크와는 체크카드 대 신용카드, 구독 장부 유무로 구분되며 같은 고객이 두 카드를 겹쳐 쓰면 잠식이 생길 수 있다.",
        "reason_to_believe": "ev:WTT6, ev:TRF11, T2, tag:auto_best, need:digital"
      },
      "tags": [
        "auto_best",
        "subscription_ledger",
        "reward_cashback",
        "anti_cap"
      ],
      "rates": {
        "dining": 0.011000000000000001,
        "online": 0.003,
        "sub": 0.003
      },
      "capPerCat": 0.5,
      "fee": 0.5,
      "minPerf": 10,
      "cx": 0.32,
      "links": [],
      "mechanics": [
        "대상과 발급: 만 19~29세 개인 회원이 앱에서 발급하고 간편결제에 등록해 쓰며, 연회비 0.5만원, 전월 이용실적 10만원 이상인 달에만 캐시백이 적용되고 할부·취소 건과 상품권·선불충전 결제는 실적과 판정 이용액에서 제외한다. 매월 말일 외식·배달, 온라인쇼핑, 구독·디지털 세 영역의 직전 3개월 이용액 합계가 가장 큰 영역을 1위로 정해(발급 후 3개월 미만은 이용한 달까지의 합계) 다음 달 청구 시 1위 영역 1.1%, 나머지 두 영역 0.3%를 캐시백하며 영역별 월 한도는 5천원이다(위 rates는 외식·배달이 1위인 소비 패턴 기준 설계값).",
        "구독 장부: 카드로 반복 결제되는 구독을 앱이 모아 월 합계와 다음 결제 예정일을 결제 3일 전에 알리고, 연 단위 결제는 판정 이용액에 12개월로 나눠 반영하며, 알림은 고객이 끌 수 있다.",
        "체리피킹 방어와 고지: 1위 영역을 3개월 합계로 판정해 월말 몰아 결제로 영역을 바꾸기 어렵고, 영역별 월 한도와 전월 이용실적 조건을 둔다. 배정 결과와 산정 근거는 앱에서 매월 고지하고 혜택 변경은 사전 고지하며, 앱 첫 화면의 현재 1위 영역은 월말 판정 전 중간 집계로 바뀔 수 있다고 표시한다."
      ],
      "evidence_ids": [
        "ev:WTT6",
        "ev:TRF11",
        "ev:TRF10",
        "T2",
        "tag:auto_best",
        "need:digital"
      ],
      "assumptions": [
        "결제 내역의 이용액 순위로 영역이 정해지는 방식을 직접 고르는 방식보다 편하다고 느낀다(가정)",
        "구독 결제 장부와 예정 알림이 카드를 주 카드로 쓸 이유 중 하나가 된다(가정, ev:WTT6의 관리 부족 낭비 77.4%는 구독 전반의 응답이며 카드 선택 이유가 아니다)",
        "3개월 합계 판정과 구독 반복 결제 식별을 기존 승인·청구 시스템에서 월 단위로 처리할 수 있다(내부 데이터 확인 필요)",
        "ev:TRF10, ev:TRF11은 20대 OTT 이용 수치이고 외식·배달 영역의 직접 근거는 아니다"
      ],
      "hypotheses": [
        "혜택 영역을 직접 고르는 카드와 직전 3개월 이용액 순위로 자동 배정되는 카드 중 어느 쪽을 쓰겠습니까, 이유는 무엇입니까?",
        "자동 배정으로 통제감을 잃는다고 느끼지 않으려면 앱에 어떤 정보가 보여야 합니까?",
        "구독 결제 일정을 모아 알려 주는 기능이 이 카드를 선택하거나 계속 쓰는 데 얼마나 영향을 줍니까?"
      ],
      "risks": [
        "자동 배정 기준을 고객이 이해하지 못하면 불만과 민원이 생길 수 있어 고지 문구 검토가 필요하다(사람 확인 필요)",
        "결제 내역 분석을 혜택 산정과 알림에 쓰는 데 따른 개인정보 활용 동의 범위 확인이 필요하다(사람 확인 필요)",
        "자사 Deep Dream 체크와 같은 고객층에서 잠식이 생길 수 있다(내부 데이터 확인 필요)",
        "외식·카페 태그 카드가 많아 외식 영역 체감 차이가 작을 수 있다(가정)"
      ],
      "rationale": "pick의 공백 방식 auto_best를 중심 장치로 쓰고, 영역을 외식·온라인·구독 세 축으로 좁혀 원가를 묶었다. 구독 장부는 ev:WTT6의 관리 부족 낭비를 카드 기능으로 받는 장치다. 혜택률은 원가 검증 전 설계값이며 외식·배달에 가장 큰 비율을 둔 것은 pick.domain 때문이다."
    },
    "metrics": {
      "i": 0,
      "name": "이용액 1위 영역 자동 배정·구독 장부 카드(가칭)",
      "profit": 3.17,
      "novelty": 0.25,
      "sim": 0.22,
      "nearest": "카카오뱅크 K-패스 프렌즈 체크",
      "cx": 0.32,
      "indepCx": 0.46,
      "appliedCx": 0.32,
      "adopt": 0.408,
      "adopterProfit": 2.58,
      "cherry": 0.4,
      "topReject": "inertia",
      "special_point_ok": true,
      "errs": [],
      "pass": true,
      "score": 0.487
    },
    "persona_types": [
      {
        "type": "일반형",
        "traits": "카테고리별 평균 소비 패턴, 평균 3년 유지"
      },
      {
        "type": "체리피커",
        "traits": "혜택 민감도 높고 전환 장벽 낮음, 혜택 카테고리에 소비를 몰고 나머지는 다른 카드, 1년 내 해지"
      },
      {
        "type": "충성형",
        "traits": "기존 카드 관성 큼, 전환하면 소비를 몰아 줌"
      },
      {
        "type": "휴면 위험형",
        "traits": "발급은 하지만 소비의 30%만 사용"
      }
    ],
    "twin": {
      "n_personas": 1200,
      "seed": 11,
      "target_adopt": 0.408,
      "all_segments_adopt": {
        "GenZ(만 19~29세)": 0.408,
        "사회초년생(25-29)": 0.465
      },
      "by_type": {
        "일반형": {
          "share_of_adopters": 0.39,
          "profit": 3.43
        },
        "혜택 사냥꾼(체리피커)": {
          "share_of_adopters": 0.4,
          "profit": 1.93
        },
        "충성형": {
          "share_of_adopters": 0.04,
          "profit": 5.75
        },
        "휴면 위험형": {
          "share_of_adopters": 0.17,
          "profit": 1.48
        }
      },
      "adopter_profit": 2.58,
      "static_profit": 3.17,
      "behav_floor": 1.5,
      "scenarios": [
        {
          "name": "기본",
          "adopt": 0.408
        },
        {
          "name": "경쟁사 모방(새로움 50%↓)",
          "adopt": 0.393
        },
        {
          "name": "혜택 20% 축소",
          "adopt": 0.298
        },
        {
          "name": "시장 위축",
          "adopt": 0.322
        }
      ],
      "top_reject": "inertia"
    },
    "target_adopt": 0.408
  }
}