{
  "run_id": "m1",
  "request_id": "m1-validation-r1",
  "agent": "validation",
  "contract_version": "1.0",
  "mode": "workflow",
  "today": "2026-10-23",
  "question": "예산 지킴 가산 자동 배정 카드(가칭)가 타깃에게 먹힐지 가상 고객으로 보고, 유형별 반응을 알려줘.",
  "conversation": {
    "summary": "사용자 요청: GenZ 특화 신용카드 만들어줘. H1에서 범위 확인됨: GenZ(만 19~29세), 신용카드, 투자 연계 제외, 목표 채택 의향 0.38(가정치).",
    "segment": "GenZ(만 19~29세)",
    "card_type": "신용카드",
    "period": "최근 18개월(2025-04~2026-10)",
    "assumptions": [
      "GenZ를 기준일 2026-10-20 기준 1997~2007년생 중 신용카드 발급이 가능한 만 19~29세로 해석",
      "고객사 회원·결제 데이터 없이 공개 자료와 PM 가정치로 진행",
      "목표 채택 의향 0.38은 기존 리허설과 같은 PM 가정치"
    ],
    "own_cards": []
  },
  "output_mode": "json",
  "depth": "detail",
  "payload": {
    "card": {
      "working_title": "예산 지킴 가산 자동 배정 카드(가칭)",
      "lever": "experience",
      "variation": "2안은 1안과 같은 자동 배정을 쓰되 고객이 앱에서 월 소비 예산을 정하고 예산 안에서 쓴 달에 가산을 받는 소비 통제 경험을 중심에 둔 안이며, 구독 장부는 넣지 않고 3안과 달리 타깃을 나누지 않는다.",
      "one_liner": "직전 3개월 이용액이 가장 큰 영역에 1.0%, 나머지 두 영역에 0.4%를 캐시백하고, 내가 정한 월 예산 안에서 쓴 달에는 1위 영역 비율에 0.2%p를 더하는 카드(전월 이용실적 10만원 이상인 달 한정, 영역별 월 한도 5천원)",
      "segId": "genz",
      "need": "digital",
      "hook": "혜택 영역은 결제 내역이 정하고, 내가 정한 월 예산을 지킨 달에는 가산이 붙는다",
      "special_point": {
        "hook": "고객이 앱에서 월 소비 예산을 스스로 정하고, 예산 안에서 쓴 달에 자동 배정 1위 영역의 혜택률이 올라가는 구조",
        "why_unusual": "경쟁 카드 삼성 iD ON의 자동 맞춤은 사용 영역을 정해 주는 데서 끝나고 소비 한도 설정과 연결된 혜택은 입력에 없다. 입력 DB 50종 중 예산 지킴 가산(budget_keep_bonus)은 1종, 자기 설정 예산 한도(self_budget_cap)는 1종이고 두 가지를 자동 배정과 함께 둔 카드는 없다. 소비자 조사에서 소비 통제가 필요 요소로 64.4%, 혜택 설계가 19.2%로 나와(입력 consumer, CSS4) 통제 장치가 혜택 설계보다 먼저 언급된다. 자사 Deep Dream 체크는 자동 선정은 있으나 예산 연동은 입력에 없어 이 점이 다르다.",
        "proof_mechanism": "고객이 앱에서 월 소비 예산(예: 50만원)을 정하면 해당 월 카드 이용액이 예산 이내일 때 다음 달 1위 영역 비율에 0.2%p를 더해 적용하고, 예산 변경은 분기 1회로 제한한다. 월 중에는 예산 대비 사용률을 앱에 보여 주고 80% 도달 시 알림을 보낸다.",
        "not_like": "흔한 방식은 사용 금액이 클수록 혜택을 늘려 소비를 부추기는 구조이고, 이 안은 예산을 지킨 달에 가산을 주어 혜택과 소비 통제를 같은 방향에 둔다."
      },
      "cvp": {
        "target": "월 결제일 부담을 느끼고 소비를 관리하고 싶은 만 19~29세",
        "need": "소비 통제(need:control)와 구독·디지털(need:digital)",
        "offer": "이용액 순위 자동 배정 캐시백과 고객이 정한 월 예산 지킴 가산",
        "key_benefit": "1위 영역 1.0%(예산 안에서 쓴 달 0.2%p 가산), 나머지 두 영역 0.4%, 영역별 월 한도 5천원, 전월 이용실적 10만원 이상인 달 한정",
        "alternative": "삼성 iD ON(경쟁 카드)과 별도 가계부 앱을 함께 쓰는 방식. 자사 Deep Dream 체크는 같은 영역의 자사 체크카드다.",
        "differentiator": "삼성 iD ON은 연회비 2만원, 전월 30만원, 월 1개 영역 30%(월 한도 1만원)이고 소비 한도와 혜택이 연결되지 않는다. 이 안은 연회비 0.5만원, 전월 10만원에 예산 지킴 가산을 붙였다. 자사 Deep Dream 체크와는 체크카드 대 신용카드, 예산 연동 유무로 구분되며 자동 선정 방식이 겹쳐 잠식이 생길 수 있다.",
        "reason_to_believe": "need:control, T5, tag:auto_best, ev:WTT6"
      },
      "tags": [
        "auto_best",
        "self_budget_cap",
        "budget_keep_bonus",
        "reward_point",
        "anti_cap"
      ],
      "rates": {
        "dining": 0.01,
        "online": 0.004,
        "sub": 0.004
      },
      "capPerCat": 0.5,
      "fee": 0.5,
      "minPerf": 10,
      "cx": 0.32,
      "links": [],
      "mechanics": [
        "대상과 발급: 만 19~29세 개인 회원이 앱에서 발급하고 간편결제에 등록해 쓰며, 연회비 0.5만원, 전월 이용실적 10만원 이상인 달에만 적립이 적용되고 할부·취소 건과 상품권·선불충전 결제는 실적과 판정 이용액에서 제외한다. 영역 배정과 포인트 적립: 매월 말일 외식·배달, 온라인쇼핑, 구독·디지털 세 영역의 직전 3개월 이용액 합계가 가장 큰 영역을 1위로 정해 다음 달 1위 영역 1.0%, 나머지 두 영역 0.4%를 포인트로 적립하고 영역별 월 한도는 5천원이다(위 rates는 외식·배달이 1위이고 가산 전인 기본값 기준 설계값).",
        "예산 지킴 가산: 고객이 앱에서 월 소비 예산을 정하고, 그 달 카드 이용액이 예산 이내이면 다음 달 1위 영역 비율에 0.2%p를 더하며 가산분을 포함해도 영역별 월 한도는 그대로다. 예산 변경은 분기 1회이고 예산 하한은 전월 이용실적 조건 이상으로 둔다.",
        "체리피킹 방어와 고지: 예산을 높게 잡아 가산만 받는 경로를 막기 위해 예산 변경을 분기 1회로 제한하고 가산은 영역별 월 한도 안에서만 적용한다. 예산 사용률과 배정 결과는 앱에서 매월 고지하고 혜택 변경은 사전 고지하며, 앱 알림은 고객이 끌 수 있다."
      ],
      "evidence_ids": [
        "need:control",
        "T5",
        "tag:auto_best",
        "ev:WTT6",
        "T2"
      ],
      "assumptions": [
        "월 예산을 직접 정하고 지킨 달에 가산을 받는 구조가 소비 통제 필요를 가진 고객에게 혜택으로 읽힌다(가정)",
        "예산 지킴 가산이 예산을 낮게 잡는 행동으로 이어지지 않고 실제 이용을 줄여 혜택 규모가 커지지 않는다(가정, 내부 데이터 확인 필요)",
        "예산 대비 사용률 계산과 알림을 월 단위로 처리할 수 있다(내부 데이터 확인 필요)"
      ],
      "hypotheses": [
        "월 소비 예산을 직접 정하면 가산을 받는 카드에 관심이 있습니까, 예산 설정이 번거롭다면 어느 부분입니까?",
        "예산을 지킨 달 가산이 붙는 구조와 이용액이 늘수록 혜택이 늘어나는 구조 중 어느 쪽을 선호합니까?",
        "자동 배정 영역이 내 예상과 다를 때 어떤 설명이 있으면 납득하겠습니까?"
      ],
      "risks": [
        "예산 지킴 가산 문구가 소비 절제를 약속하는 것으로 읽히지 않도록 표현 검토가 필요하다(사람 확인 필요)",
        "결제 내역과 예산 정보를 혜택 산정에 쓰는 데 따른 개인정보 활용 범위 확인이 필요하다(사람 확인 필요)",
        "자사 Deep Dream 체크와 1안이 같은 고객층에서 겹칠 수 있다(내부 데이터 확인 필요)"
      ],
      "rationale": "pick의 공백 방식 auto_best를 쓰되 두 번째 안은 고객 경험 레버를 바꿔 소비 통제 니즈(need:control, T5)를 받는다. 예산 지킴 가산은 혜택 규모를 키우지 않고 영역별 월 한도 안에서만 적용해 원가를 묶었다. 혜택률은 원가 검증 전 설계값이다."
    },
    "metrics": {
      "i": 1,
      "name": "예산 지킴 가산 자동 배정 카드(가칭)",
      "profit": 3.16,
      "novelty": 0.4,
      "sim": 0.21,
      "nearest": "처음",
      "cx": 0.32,
      "indepCx": 0.46,
      "appliedCx": 0.32,
      "adopt": 0.437,
      "adopterProfit": 2.61,
      "cherry": 0.37,
      "topReject": "inertia",
      "special_point_ok": true,
      "errs": [],
      "pass": true,
      "score": 0.525
    },
    "persona_types": [
      {
        "type": "일반형",
        "traits": "카테고리별 평균 소비 패턴, 평균 3년 유지"
      },
      {
        "type": "체리피커",
        "traits": "혜택 민감도 높고 전환 장벽 낮음, 혜택 카테고리에 소비를 몰고 나머지는 다른 카드, 1년 내 해지"
      },
      {
        "type": "충성형",
        "traits": "기존 카드 관성 큼, 전환하면 소비를 몰아 줌"
      },
      {
        "type": "휴면 위험형",
        "traits": "발급은 하지만 소비의 30%만 사용"
      }
    ],
    "twin": {
      "n_personas": 1200,
      "seed": 11,
      "target_adopt": 0.437,
      "all_segments_adopt": {
        "GenZ(만 19~29세)": 0.437,
        "사회초년생(25-29)": 0.498
      },
      "by_type": {
        "일반형": {
          "share_of_adopters": 0.42,
          "profit": 3.47
        },
        "혜택 사냥꾼(체리피커)": {
          "share_of_adopters": 0.37,
          "profit": 1.9
        },
        "충성형": {
          "share_of_adopters": 0.03,
          "profit": 5.74
        },
        "휴면 위험형": {
          "share_of_adopters": 0.18,
          "profit": 1.48
        }
      },
      "adopter_profit": 2.61,
      "static_profit": 3.16,
      "behav_floor": 1.5,
      "scenarios": [
        {
          "name": "기본",
          "adopt": 0.437
        },
        {
          "name": "경쟁사 모방(새로움 50%↓)",
          "adopt": 0.405
        },
        {
          "name": "혜택 20% 축소",
          "adopt": 0.328
        },
        {
          "name": "시장 위축",
          "adopt": 0.355
        }
      ],
      "top_reject": "inertia"
    },
    "target_adopt": 0.437
  }
}