{
  "run_id": "genz-credit-alt-001",
  "request_id": "genz-credit-alt-001-validation-r1",
  "agent": "validation",
  "contract_version": "1.0",
  "mode": "workflow",
  "today": "2026-10-20",
  "question": "은행 결합 첫 신용카드(가칭)가 GenZ(만 19~29세)에게 먹힐지 가상 고객으로 보고, 유형별 반응을 알려줘.",
  "conversation": {
    "summary": "사용자 요청: GenZ 특화 신용카드 만들어줘. H1에서 범위 확인됨: GenZ(만 19~29세), 신용카드, 투자 연계 제외, 목표 채택 의향 0.38(가정치). H2에서 사람이 1순위(구독·디지털) 대신 2순위 셀(GenZ × 단순함)을 선택했다.",
    "segment": "GenZ(만 19~29세)",
    "card_type": "신용카드",
    "period": "최근 18개월(2025-04~2026-10)",
    "assumptions": [
      "GenZ를 기준일 2026-10-20 기준 1997~2007년생 중 신용카드 발급이 가능한 만 19~29세로 해석",
      "고객사 회원·결제 데이터 없이 공개 자료와 PM 가정치로 진행",
      "목표 채택 의향 0.38은 기존 리허설과 같은 PM 가정치"
    ],
    "own_cards": []
  },
  "output_mode": "json",
  "depth": "detail",
  "payload": {
    "card": {
      "working_title": "은행 결합 첫 신용카드(가칭)",
      "lever": "partnership",
      "variation": "제휴 은행 결제계좌 지정을 전월 실적 조건 대신 쓰고, 금융이력이 짧은 청년이 보증금 담보로 시작할 수 있게 한 제휴 구조 안이며, 1안과 2안은 카드사 단독으로 실적 조건을 다룬다.",
      "one_liner": "카드대금 결제계좌를 제휴 은행 계좌로 지정하면 실적 계산 없이 외식·배달 0.7%, 온라인쇼핑 0.6% 캐시백이 붙고, 금융이력이 짧으면 보증금 담보로 시작할 수 있는 연회비 없는 첫 신용카드",
      "segId": "genz",
      "need": "simple",
      "hook": "실적 조건 대신 결제계좌 하나, 금융이력이 짧아도 은행 계좌로 시작하는 첫 신용카드",
      "special_point": {
        "hook": "혜택 조건을 이용금액 구간이 아닌 제휴 은행 결제계좌 지정 하나로 바꾸고, 금융이력이 짧은 청년은 은행 보증금 담보로 발급받은 뒤 정상 납부 이력에 따라 일반 신용카드 전환 심사를 받는 구조",
        "why_unusual": "경쟁 카드 34종 중 실적조건 완화(anti_cap)는 0종이고 챌린지(challenge)는 1종뿐이며 young 타깃 카드에는 없다(comp_empty). 금융당국이 대안신용평가와 보증금 담보 신용카드 도입으로 청년 등 금융이력부족자 발급을 쉽게 하겠다고 한 방향(T4)과 결합된 신용카드 상품은 입력 DB에 없다.",
        "proof_mechanism": "발급 시 제휴 은행 계좌를 카드대금 결제계좌로 지정한 회원에게 이용금액 구간 판정 없이 캐시백을 적용하고, 금융이력이 짧아 일반 심사가 어려운 신청자는 제휴 은행 예금을 보증금으로 묶어 그 범위 안의 이용한도로 발급한다. 12개월 연속 정상 납부 시 일반 신용카드 전환과 보증금 해제 심사를 신청할 수 있다.",
        "not_like": "흔한 은행 결합 카드는 급여이체나 예금 잔액 같은 은행 실적과 카드 실적을 함께 요구하고, 흔한 청년 카드는 금융이력이 있어야 발급되는데, 이 안은 결제계좌 지정 하나로 조건을 대신하고 발급 문턱 자체를 제휴로 낮춘다."
      },
      "cvp": {
        "target": "금융이력이 짧아 첫 신용카드 발급이 어렵거나 실적 조건을 맞추기 부담스러운 만 19~29세(대학생, 사회 진입 직후)",
        "need": "단순함(need:simple)과 첫 신용카드 진입, 절약(need:saving)",
        "offer": "제휴 은행 결제계좌 지정만으로 외식·배달 0.7%, 온라인쇼핑 0.6% 캐시백, 연회비 없음, 보증금 담보 발급 경로와 12개월 정상 납부 후 전환 심사",
        "key_benefit": "실적 계산 없이 혜택이 붙고, 금융이력이 짧아도 신용카드를 시작해 납부 이력을 쌓을 수 있다",
        "alternative": "무실적 체크카드, 실적 조건이 있는 일반 청년 신용카드",
        "differentiator": "카드 이용금액 대신 은행 결제계좌 지정을 혜택 조건으로 쓰고, 은행 보증금으로 발급 문턱을 낮춘다",
        "reason_to_believe": "T4, tag:anti_cap, tag:challenge, need:simple"
      },
      "tags": [
        "bank_bundle",
        "anti_cap",
        "reward_cashback",
        "challenge"
      ],
      "rates": {
        "dining": 0.007,
        "online": 0.006
      },
      "capPerCat": 0.4,
      "fee": 0,
      "minPerf": 0,
      "cx": 0.3,
      "links": [
        "bank"
      ],
      "mechanics": [
        "대상과 가입: 만 19세 이상 29세 이하 개인이 제휴 은행 앱 또는 카드사 앱에서 신청하고, 카드대금 결제계좌를 제휴 은행 계좌로 지정하면 연회비 없이 발급되며 전월 이용금액 조건은 두지 않는다.",
        "적립과 한도: 결제계좌 지정이 유지되는 달에 외식·배달 0.7%, 온라인쇼핑 0.6%를 다음 달 청구 시 캐시백하고, 영역별 월 캐시백 한도는 4천원이며 결제계좌를 다른 은행으로 바꾸면 그 달부터 캐시백을 적용하지 않는다.",
        "보증금 발급 경로: 금융이력이 짧아 일반 심사가 어려운 신청자는 제휴 은행 예금을 보증금으로 지정해 그 범위 안의 이용한도로 발급하고, 12개월 연속 정상 납부 시 일반 신용카드 전환과 보증금 해제 심사를 신청할 수 있으며 세부 기준은 금융당국 제도 세부 기준이 나온 뒤 정한다.",
        "체리피킹 방어와 고지: 상품권·선불충전·할부 취소 건은 캐시백에서 제외하고, 결제계좌 지정 해제 시 다음 청구일부터 혜택 중단을 앱과 문자로 사전 고지하며 혜택 변경도 사전 고지한다."
      ],
      "evidence_ids": [
        "T4",
        "T5",
        "need:simple",
        "tag:anti_cap",
        "tag:challenge"
      ],
      "assumptions": [
        "제휴 은행이 결제계좌 유치를 위해 혜택 원가 일부를 분담할 의향이 있다(가정)",
        "보증금 담보 신용카드 제도가 T4에서 밝힌 방향대로 시행되어 발급 경로로 쓸 수 있다(사람 확인 필요)",
        "결제계좌 지정 하나를 조건으로 두면 GenZ 고객이 실적 조건보다 단순하다고 느낀다(가정)"
      ],
      "hypotheses": [
        "카드 이용금액 조건 대신 결제계좌를 특정 은행으로 지정하는 조건이라면 이 카드를 발급하겠습니까?",
        "금융이력이 짧아 보증금을 맡기고 시작하는 신용카드라면 체크카드 대신 쓸 의향이 있습니까?",
        "12개월 정상 납부 후 일반 신용카드로 전환 심사를 받을 수 있다는 점이 발급 동기가 됩니까?"
      ],
      "risks": [
        "보증금 담보 신용카드의 세부 발급 기준과 시행 시점은 사람 확인 필요다(T4)",
        "은행 결합 조건이 특정 은행 계좌 개설 강요로 읽히지 않도록 판매 방식 검토가 필요하다(사람 확인 필요)",
        "실적 조건이 없어 저이용 회원 비중이 높으면 원가 대비 수익이 낮을 수 있다(내부 데이터 확인 필요)",
        "제휴 은행 원가 분담 조건은 제휴 협상 결과에 따라 달라진다(내부 데이터 확인 필요)"
      ],
      "rationale": "pick이 근거로 든 T4의 청년 발급 문턱 완화와 공백 태그 anti_cap을 은행 제휴 구조로 묶었다. 실적 조건을 결제계좌 지정 하나로 대신해 단순함을 확보하고, 실적 조건이 없는 만큼 영역을 두 곳으로 줄이고 비율과 한도를 낮춰 원가를 묶었다. 투자 연계는 범위 밖이라 links는 bank만 썼다. 혜택률은 원가 검증 전 설계값이다."
    },
    "metrics": {
      "i": 2,
      "name": "은행 결합 첫 신용카드(가칭)",
      "profit": 3.06,
      "novelty": 0.5,
      "sim": 0.22,
      "nearest": "카카오뱅크 K-패스 프렌즈 체크",
      "cx": 0.3,
      "indepCx": 0.43,
      "appliedCx": 0.3,
      "adopt": 0.382,
      "adopterProfit": 2.14,
      "cherry": 0.46,
      "topReject": "inertia",
      "special_point_ok": true,
      "errs": [],
      "pass": true,
      "score": 0.534
    },
    "persona_types": [
      {
        "type": "일반형",
        "traits": "카테고리별 평균 소비 패턴, 평균 3년 유지"
      },
      {
        "type": "체리피커",
        "traits": "혜택 민감도 높고 전환 장벽 낮음, 혜택 카테고리에 소비를 몰고 나머지는 다른 카드, 1년 내 해지"
      },
      {
        "type": "충성형",
        "traits": "기존 카드 관성 큼, 전환하면 소비를 몰아 줌"
      },
      {
        "type": "휴면 위험형",
        "traits": "발급은 하지만 소비의 30%만 사용"
      }
    ],
    "twin": {
      "n_personas": 1800,
      "seed": 11,
      "target_adopt": 0.382,
      "all_segments_adopt": {
        "GenZ(만 19~29세)": 0.382,
        "사회초년생(25-29)": 0.437,
        "1인가구 직장인(30-39)": 0.492
      },
      "by_type": {
        "일반형": {
          "share_of_adopters": 0.33,
          "profit": 3.51
        },
        "혜택 사냥꾼(체리피커)": {
          "share_of_adopters": 0.46,
          "profit": 1.27
        },
        "충성형": {
          "share_of_adopters": 0.04,
          "profit": 5.55
        },
        "휴면 위험형": {
          "share_of_adopters": 0.17,
          "profit": 1.11
        }
      },
      "adopter_profit": 2.14,
      "static_profit": 3.06,
      "behav_floor": 1.5,
      "scenarios": [
        {
          "name": "기본",
          "adopt": 0.382
        },
        {
          "name": "경쟁사 모방(새로움 50%↓)",
          "adopt": 0.34
        },
        {
          "name": "혜택 20% 축소",
          "adopt": 0.303
        },
        {
          "name": "시장 위축",
          "adopt": 0.323
        }
      ],
      "top_reject": "inertia"
    },
    "target_adopt": 0.382
  }
}