{
  "run_id": "a2",
  "request_id": "a2-validation-r1",
  "agent": "validation",
  "contract_version": "1.0",
  "mode": "workflow",
  "today": "2026-10-23",
  "question": "첫 신용카드 실적 졸업 카드(가칭)가 타깃에게 먹힐지 가상 고객으로 보고, 유형별 반응을 알려줘.",
  "conversation": {
    "summary": "사용자 요청: GenZ 특화 신용카드 만들어줘. H1에서 범위 확인됨: GenZ(만 19~29세), 신용카드, 투자 연계 제외, 목표 채택 의향 0.38(가정치).",
    "segment": "GenZ(만 19~29세)",
    "card_type": "신용카드",
    "period": "최근 18개월(2025-04~2026-10)",
    "assumptions": [
      "GenZ를 기준일 2026-10-20 기준 1997~2007년생 중 신용카드 발급이 가능한 만 19~29세로 해석",
      "고객사 회원·결제 데이터 없이 공개 자료와 PM 가정치로 진행",
      "목표 채택 의향 0.38은 기존 리허설과 같은 PM 가정치"
    ],
    "own_cards": []
  },
  "output_mode": "json",
  "depth": "detail",
  "payload": {
    "card": {
      "working_title": "첫 신용카드 실적 졸업 카드(가칭)",
      "lever": "target_subsegment",
      "variation": "3안은 타깃을 만 19~24세 첫 신용카드 진입층으로 좁히고 영역별 첫 이용 보상과 6개월 정상 납부 뒤 실적 조건이 낮아지는 졸업 구조를 둔 안이며, 1안과 2안은 자동 배정으로 GenZ 전체를 같은 구조로 다룬다.",
      "one_liner": "처음 쓰는 외식·온라인·구독 영역마다 첫 이용 보상을 주고, 6개월 연속 정상 납부와 실적 충족을 마치면 전월 이용실적 조건이 낮아지는 첫 신용카드(전월 이용실적 20만원 이상인 달 한정, 영역별 월 한도 5천원)",
      "segId": "genz",
      "need": "digital",
      "hook": "처음 써 보는 영역에 보상이 붙고, 6개월 정상 납부를 마치면 실적 조건이 낮아진다",
      "special_point": {
        "hook": "영역별 첫 이용 보상과 6개월 정상 납부 뒤 전월 실적 조건이 20만원에서 10만원으로 낮아지는 실적 졸업 구조",
        "why_unusual": "입력 DB 50종 중 첫 시도 보상(first_try_reward)과 실적 졸업(perf_graduation) 태그는 모두 0종이고, 경쟁 카드 zgm.streaming카드는 연회비 1.2만원에 전월 40만원 실적을 요구해 첫 카드 진입층에는 문턱이 높다. 금융이력이 짧은 청년의 발급 문턱이 낮아지는 정책 흐름(T1)에서 첫 신용카드 고객은 늘 수 있으나 이를 혜택 설계로 받는 카드는 입력에 없다. 자사 Pick E 체크, Pick I 체크는 체크카드로 편의점·커피 10%(월 1천P 한도)를 주며 신용 이력 쌓기 설계는 입력에 없다.",
        "proof_mechanism": "처음 이용하는 영역(외식·배달, 온라인쇼핑, 구독·디지털)마다 첫 결제에 1천P를 1회 적립하고, 발급 후 6개월 연속 정상 납부와 월 실적 20만원 충족을 마치면 앱에서 실적 조건이 10만원으로 낮아지는 졸업 안내와 이용한도 상향 심사 신청 자격을 연다. 졸업 전 진행 개월 수는 앱 챌린지 화면에 표시한다.",
        "not_like": "흔한 청년 카드는 연령 제한 할인을 같은 실적 조건으로 유지하고, 이 안은 납부 이력이 쌓일수록 실적 부담이 줄어드는 단계를 혜택 설계에 직접 둔다."
      },
      "cvp": {
        "target": "첫 신용카드를 발급하는 만 19~24세(대학생, 사회 진입 직전)",
        "need": "구독·디지털(need:digital)과 첫 카드 진입 문턱 낮추기, 소비 통제",
        "offer": "영역별 첫 이용 보상, 6개월 정상 납부 뒤 실적 조건 완화(졸업), 이용한도 상향 심사 신청 자격",
        "key_benefit": "외식·배달 1.1%, 구독·디지털 0.8%, 온라인쇼핑 0.2%(영역별 월 한도 5천원, 전월 이용실적 20만원 이상인 달 한정)에 첫 이용 보상이 더해지고 6개월 뒤 실적 조건이 낮아진다",
        "alternative": "zgm.streaming카드(경쟁 카드)와 체크카드 계속 사용. 자사 Pick E 체크, Pick I 체크는 같은 연령대의 자사 체크카드다.",
        "differentiator": "zgm.streaming카드는 연회비 1.2만원, 전월 40만원, 구독 멤버십·스트리밍 건별 할인이고, 이 안은 연회비 0.5만원, 전월 20만원에서 시작해 졸업 후 10만원으로 낮아지는 단계 구조다. 자사 Pick E·Pick I 체크는 체크카드 소액 정액 혜택이라 신용 이력 단계 설계 유무로 구분되며 체크카드에서 신용카드로 넘어오는 고객의 잠식은 내부 데이터 확인이 필요하다.",
        "reason_to_believe": "T1, T5, need:digital, ev:TRF11"
      },
      "tags": [
        "first_try_reward",
        "perf_graduation",
        "challenge",
        "reward_point"
      ],
      "rates": {
        "dining": 0.011000000000000001,
        "sub": 0.008,
        "online": 0.002
      },
      "capPerCat": 0.5,
      "fee": 0.5,
      "minPerf": 20,
      "cx": 0.32,
      "links": [],
      "mechanics": [
        "대상과 발급: 만 19~24세 신규 신용카드 회원이 앱에서 발급하고 간편결제에 등록해 쓰며, 연회비 0.5만원, 전월 이용실적 20만원 이상인 달에 외식·배달 1.1%, 구독·디지털 0.8%, 온라인쇼핑 0.2%를 포인트로 적립하고 영역별 월 한도는 5천원이다(졸업 전 첫 기간 기준 설계값). 첫 이용 보상: 처음 이용하는 영역마다 첫 결제 건에 1천P를 영역당 1회 적립하며, 상품권·선불충전 결제와 취소 건은 보상 대상에서 제외한다.",
        "실적 졸업: 발급 후 6개월 연속 결제대금 정상 납부와 월 실적 20만원 충족을 마치면 전월 이용실적 조건이 10만원으로 낮아지고 이용한도 상향 심사 신청 자격이 생기며, 심사 결과와 상향 폭은 신용평가 기준에 따르고 연체가 생기면 개월 수를 처음부터 다시 센다.",
        "체리피킹 방어와 고지: 첫 이용 보상은 영역당 1회이고 졸업은 카드당 1회이며 영역별 월 적립 한도를 둔다. 챌린지 진행 현황과 졸업 일정은 앱에서 매월 고지하고 혜택 변경은 사전 고지하며, 만 25세 도달 시 만 19~24세 한정 조건이 끝나는 시점도 사전 고지한다."
      ],
      "evidence_ids": [
        "T1",
        "T5",
        "need:digital",
        "ev:TRF11",
        "ev:CST9"
      ],
      "assumptions": [
        "첫 신용카드 고객은 영역별 첫 이용 보상과 실적 부담 완화에 반응한다(가정, 입력에 19~24세 구간 소비 수치 없음)",
        "대안신용평가와 보증금 담보 신용카드 도입으로 첫 신용카드 발급 대상이 넓어진다(T1, 세부 기준은 사람 확인 필요)",
        "6개월 정상 납부 기준이 연체 위험을 키우지 않고 이용 지속으로 이어진다(내부 데이터 확인 필요)",
        "ev:CST9는 2022년 KB국민카드 학생증 체크카드 회원 한정 자료여서 대학생 소비 구성의 참고에 그친다"
      ],
      "hypotheses": [
        "첫 신용카드를 고를 때 6개월 정상 납부 뒤 실적 조건이 낮아지는 구조가 선택에 영향을 줍니까?",
        "새로운 영역을 처음 써 볼 때 주는 소액 보상이 실제 이용으로 이어질 것 같습니까?",
        "체크카드를 쓰다가 첫 신용카드로 옮길 때 가장 걱정되는 점은 무엇입니까?"
      ],
      "risks": [
        "한도 상향 심사 신청 자격 문구가 상향을 약속하는 것으로 읽히지 않도록 표현 검토가 필요하다(사람 확인 필요)",
        "연령 기준 대상 한정과 첫 신용카드 고객 연체 위험, 한도 운영 기준은 내부 데이터 확인 필요",
        "자사 Pick E, Pick I 체크 고객이 신용카드로 넘어오는 흐름에서 잠식이 생길 수 있다(내부 데이터 확인 필요)"
      ],
      "rationale": "auto_best 외의 방식으로 같은 영역을 푸는 안이며 타깃 세분 레버를 바꿔 첫 신용카드 진입층의 실적 부담을 직접 다룬다. T1과 T5를 근거로 문턱 완화와 연체 부담 신호를 함께 설계에 반영했고, 실적 조건은 첫 기간 값인 20만원으로 썼다. 혜택률은 원가 검증 전 설계값이다."
    },
    "metrics": {
      "i": 2,
      "name": "첫 신용카드 실적 졸업 카드(가칭)",
      "profit": 3.1,
      "novelty": 0.5,
      "sim": 0.25,
      "nearest": "처음(ANNIVERSE)",
      "cx": 0.32,
      "indepCx": 0.46,
      "appliedCx": 0.32,
      "adopt": 0.375,
      "adopterProfit": 2.43,
      "cherry": 0.44,
      "topReject": "inertia",
      "special_point_ok": true,
      "errs": [],
      "pass": false,
      "score": 0.523
    },
    "persona_types": [
      {
        "type": "일반형",
        "traits": "카테고리별 평균 소비 패턴, 평균 3년 유지"
      },
      {
        "type": "체리피커",
        "traits": "혜택 민감도 높고 전환 장벽 낮음, 혜택 카테고리에 소비를 몰고 나머지는 다른 카드, 1년 내 해지"
      },
      {
        "type": "충성형",
        "traits": "기존 카드 관성 큼, 전환하면 소비를 몰아 줌"
      },
      {
        "type": "휴면 위험형",
        "traits": "발급은 하지만 소비의 30%만 사용"
      }
    ],
    "twin": {
      "n_personas": 1200,
      "seed": 11,
      "target_adopt": 0.375,
      "all_segments_adopt": {
        "GenZ(만 19~29세)": 0.375,
        "사회초년생(25-29)": 0.448
      },
      "by_type": {
        "일반형": {
          "share_of_adopters": 0.36,
          "profit": 3.33
        },
        "혜택 사냥꾼(체리피커)": {
          "share_of_adopters": 0.44,
          "profit": 1.8
        },
        "충성형": {
          "share_of_adopters": 0.04,
          "profit": 5.63
        },
        "휴면 위험형": {
          "share_of_adopters": 0.16,
          "profit": 1.39
        }
      },
      "adopter_profit": 2.43,
      "static_profit": 3.1,
      "behav_floor": 1.5,
      "scenarios": [
        {
          "name": "기본",
          "adopt": 0.375
        },
        {
          "name": "경쟁사 모방(새로움 50%↓)",
          "adopt": 0.332
        },
        {
          "name": "혜택 20% 축소",
          "adopt": 0.265
        },
        {
          "name": "시장 위축",
          "adopt": 0.283
        }
      ],
      "top_reject": "inertia"
    },
    "target_adopt": 0.375
  }
}